id,type,title,channel_or_publisher,url,published,discovered,status,priority,domains,notes
yt--aATaSLfVvI,short,Biz 101: How To Run A Meeting,@thefutur,https://www.youtube.com/watch?v=-aATaSLfVvI,NA,2026-07-14,L0-discovered,3,,views=16000
yt-Q7CL69AphR8,short,How to Get More Clients and Grow Your Business,@thefutur,https://www.youtube.com/watch?v=Q7CL69AphR8,NA,2026-07-14,L0-discovered,3,,views=13000
yt--GRcBGcan9I,short,Sell Money,@thefutur,https://www.youtube.com/watch?v=-GRcBGcan9I,NA,2026-07-14,L0-discovered,3,,views=59000
yt-GuL6jbXe5oY,short,Why You're Not Getting YouTube Views,@thefutur,https://www.youtube.com/watch?v=GuL6jbXe5oY,NA,2026-07-14,L0-discovered,3,,views=44000
yt-BglGy_C6XRU,short,How to Make Solid Content,@thefutur,https://www.youtube.com/watch?v=BglGy_C6XRU,NA,2026-07-14,L0-discovered,3,,views=17000
yt-qrpxw4f8enM,short,Should You  💰 Hire Creators 📷 ?,@thefutur,https://www.youtube.com/watch?v=qrpxw4f8enM,NA,2026-07-14,L0-discovered,3,,views=20000
yt-po2mplw728I,short,How To Grow An Audience and Build Expertise,@thefutur,https://www.youtube.com/watch?v=po2mplw728I,NA,2026-07-14,L0-discovered,3,,views=22000
yt-mKh1t4Hb1ps,short,Why Explaining Your Prices Undermines Your Leverage with Clients,@thefutur,https://www.youtube.com/watch?v=mKh1t4Hb1ps,NA,2026-07-14,L0-discovered,3,,views=817000
yt-NEsW-u6Pm9w,short,Find Your Smallest Viable Audience by Splitting the Market,@thefutur,https://www.youtube.com/watch?v=NEsW-u6Pm9w,NA,2026-07-14,L0-discovered,3,,views=93000
yt-VYBxVEqQAv0,short,How To Handle Any Client Objection Fast!,@thefutur,https://www.youtube.com/watch?v=VYBxVEqQAv0,NA,2026-07-14,L0-discovered,3,,views=815000
yt-c32NcVxI9Qg,short,3 Components of Life,@thefutur,https://www.youtube.com/watch?v=c32NcVxI9Qg,NA,2026-07-14,L0-discovered,3,,views=17000
yt-byFdqxOAfwE,short,Futur x Studio Innate Tee-Shirt Merch Collaboration,@thefutur,https://www.youtube.com/watch?v=byFdqxOAfwE,NA,2026-07-14,L0-discovered,3,,views=23000
yt-UBUsG-TCsvQ,short,The Futur is Coming To Europe 2023,@thefutur,https://www.youtube.com/watch?v=UBUsG-TCsvQ,NA,2026-07-14,L0-discovered,3,,views=27000
yt-KDH_QkhCKiU,short,Simplifying What You Do Is Key To Success,@thefutur,https://www.youtube.com/watch?v=KDH_QkhCKiU,NA,2026-07-14,L0-discovered,3,,views=41000
yt-Lr5JaN6detM,short,Realize your TRUE POTENTIAL in life,@thefutur,https://www.youtube.com/watch?v=Lr5JaN6detM,NA,2026-07-14,L0-discovered,3,,views=21000
yt-VNc8-5qlDsM,short,Short Term Reward Is Killing Your Business,@thefutur,https://www.youtube.com/watch?v=VNc8-5qlDsM,NA,2026-07-14,L0-discovered,3,,views=27000
yt-eZF_P-YDlH4,short,Stop Hiding And Market Yourself,@thefutur,https://www.youtube.com/watch?v=eZF_P-YDlH4,NA,2026-07-14,L0-discovered,3,,views=49000
yt-WZi788gdQWc,short,What You Put Out Is What You Attract,@thefutur,https://www.youtube.com/watch?v=WZi788gdQWc,NA,2026-07-14,L0-discovered,3,,views=23000
yt-cINNZJee7as,short,You Have No Business Without Sales and Marketing,@thefutur,https://www.youtube.com/watch?v=cINNZJee7as,NA,2026-07-14,L0-discovered,3,,views=29000
yt-Bd4aSgt01rs,short,You Are NOT For Every Client,@thefutur,https://www.youtube.com/watch?v=Bd4aSgt01rs,NA,2026-07-14,L0-discovered,3,,views=28000
yt-S98s1Gd53y4,short,Why Charging By The Hour Doesn't Make Sense,@thefutur,https://www.youtube.com/watch?v=S98s1Gd53y4,NA,2026-07-14,L0-discovered,3,,views=44000000
yt-rRCK5_M2om8,short,How Telling A Story Helps People Understand,@thefutur,https://www.youtube.com/watch?v=rRCK5_M2om8,NA,2026-07-14,L0-discovered,3,,views=34000
yt-Iuvx4o3HeKg,short,Sell The Transformation You Create For Others,@thefutur,https://www.youtube.com/watch?v=Iuvx4o3HeKg,NA,2026-07-14,L0-discovered,3,,views=19000
yt-4L7pKG8ubUM,short,Use This Sales Technique To Win More Clients,@thefutur,https://www.youtube.com/watch?v=4L7pKG8ubUM,NA,2026-07-14,L0-discovered,3,,views=32000
yt-jPZxhWOAW4w,short,Charge Higher Prices By Doing THIS,@thefutur,https://www.youtube.com/watch?v=jPZxhWOAW4w,NA,2026-07-14,L0-discovered,3,,views=45000
yt-5aDDUE5tYl0,short,UX and Business,@thefutur,https://www.youtube.com/watch?v=5aDDUE5tYl0,NA,2026-07-14,L0-discovered,3,,views=14000
yt-R2HgFPUlJ_k,short,UX As It Relates To Psychology,@thefutur,https://www.youtube.com/watch?v=R2HgFPUlJ_k,NA,2026-07-14,L0-discovered,3,,views=14000
yt-KYb0e1O6r58,short,UX Instructor Vincent Brathwaite,@thefutur,https://www.youtube.com/watch?v=KYb0e1O6r58,NA,2026-07-14,L0-discovered,3,,views=10000
yt-kk7y72B7IiE,short,How To Make Money Doing What You Love (Ikigai),@thefutur,https://www.youtube.com/watch?v=kk7y72B7IiE,NA,2026-07-14,L0-discovered,3,,views=37000
yt-IsES_8mjfwY,short,The Psychology Of Raising Your Prices,@thefutur,https://www.youtube.com/watch?v=IsES_8mjfwY,NA,2026-07-14,L0-discovered,3,,views=42000
yt-PlL506tsn1I,short,What Clients ACTUALLY Want From You,@thefutur,https://www.youtube.com/watch?v=PlL506tsn1I,NA,2026-07-14,L0-discovered,3,,views=22000
yt-3PDBbG-Yx4U,short,Talk About Budget Early w/ Clients,@thefutur,https://www.youtube.com/watch?v=3PDBbG-Yx4U,NA,2026-07-14,L0-discovered,3,,views=20000
yt-Ys79-78mw6M,short,Sales Roleplay— you're too expensive,@thefutur,https://www.youtube.com/watch?v=Ys79-78mw6M,NA,2026-07-14,L0-discovered,3,,views=55000
yt-i2d3dmbSlF0,short,The True Metric of Success,@thefutur,https://www.youtube.com/watch?v=i2d3dmbSlF0,NA,2026-07-14,L0-discovered,3,,views=19000
yt-yt8H1Wn1RAg,short,How to Find Your Market,@thefutur,https://www.youtube.com/watch?v=yt8H1Wn1RAg,NA,2026-07-14,L0-discovered,3,,views=20000
yt-vMPIQIeDG7w,short,The Importance of Being First In the Mind of the Customer,@thefutur,https://www.youtube.com/watch?v=vMPIQIeDG7w,NA,2026-07-14,L0-discovered,3,,views=16000
yt-VuYK8XkgTvg,short,Upload Your IG Carousels as Linkedin Documents to get more reach,@thefutur,https://www.youtube.com/watch?v=VuYK8XkgTvg,NA,2026-07-14,L0-discovered,3,,views=19000
yt-oPHIpNFSWeY,short,More Visual Real Estate,@thefutur,https://www.youtube.com/watch?v=oPHIpNFSWeY,NA,2026-07-14,L0-discovered,3,,views=421
yt-B9MSCK-MX-g,short,How To Set Goals,@thefutur,https://www.youtube.com/watch?v=B9MSCK-MX-g,NA,2026-07-14,L0-discovered,3,,views=26000
yt-dl6i2My29Fw,short,What To Study To Get More Views On YouTube,@thefutur,https://www.youtube.com/watch?v=dl6i2My29Fw,NA,2026-07-14,L0-discovered,3,,views=16000
yt-7QHm-Yr_tg4,short,Being Vulnerable Is A Strength,@thefutur,https://www.youtube.com/watch?v=7QHm-Yr_tg4,NA,2026-07-14,L0-discovered,3,,views=13000
yt-hANpWMC5chs,short,The Market Is Bigger Than Your Target,@thefutur,https://www.youtube.com/watch?v=hANpWMC5chs,NA,2026-07-14,L0-discovered,3,,views=15000
yt-KZwrsuEAP5Q,short,Being Spotlighted By An Influencer…,@thefutur,https://www.youtube.com/watch?v=KZwrsuEAP5Q,NA,2026-07-14,L0-discovered,3,,views=13000
yt-4oXw1OQFIXw,short,Get Followers By Doing Guest Posts,@thefutur,https://www.youtube.com/watch?v=4oXw1OQFIXw,NA,2026-07-14,L0-discovered,3,,views=11000
yt-VnIra3xS3H8,short,How To Build A Deeper Relationship With a Client,@thefutur,https://www.youtube.com/watch?v=VnIra3xS3H8,NA,2026-07-14,L0-discovered,3,,views=13000
yt-LYMFHaKRpck,short,How To Stay Consistent In Creating Content,@thefutur,https://www.youtube.com/watch?v=LYMFHaKRpck,NA,2026-07-14,L0-discovered,3,,views=16000
yt-PdTPeRGGjtw,short,How To Create Content That Gets Views,@thefutur,https://www.youtube.com/watch?v=PdTPeRGGjtw,NA,2026-07-14,L0-discovered,3,,views=13000
yt-IayqXDMSDzw,short,Build Client Relationships Quickly,@thefutur,https://www.youtube.com/watch?v=IayqXDMSDzw,NA,2026-07-14,L0-discovered,3,,views=13000
yt-RsCEq_7xzqU,short,5 Tips For More Content Engagement,@thefutur,https://www.youtube.com/watch?v=RsCEq_7xzqU,NA,2026-07-14,L0-discovered,3,,views=9200
yt-sC9OUSwb6H8,short,Algorithms Explained,@thefutur,https://www.youtube.com/watch?v=sC9OUSwb6H8,NA,2026-07-14,L0-discovered,3,,views=12000
yt-CbTezrNKPZo,short,Why Social Proof Is So Persuasive,@thefutur,https://www.youtube.com/watch?v=CbTezrNKPZo,NA,2026-07-14,L0-discovered,3,,views=15000
yt-ysvoerUjAZY,short,2 Hacks To Increase Comments On Your Post,@thefutur,https://www.youtube.com/watch?v=ysvoerUjAZY,NA,2026-07-14,L0-discovered,3,,views=14000
yt-VSWfG6rirSo,short,How To Create Content That Gets Sales,@thefutur,https://www.youtube.com/watch?v=VSWfG6rirSo,NA,2026-07-14,L0-discovered,3,,views=14000
yt-_W2p7qD0OtY,short,3 Hacks For Viral Content,@thefutur,https://www.youtube.com/watch?v=_W2p7qD0OtY,NA,2026-07-14,L0-discovered,3,,views=11000
yt-xIHMfsqvlyE,short,The Power Of Being Your Full Self,@thefutur,https://www.youtube.com/watch?v=xIHMfsqvlyE,NA,2026-07-14,L0-discovered,3,,views=11000
yt-pyPhCFInKoM,short,Why Your Competitors Are Always Ahead Of You,@thefutur,https://www.youtube.com/watch?v=pyPhCFInKoM,NA,2026-07-14,L0-discovered,3,,views=13000
yt-w6wW3-awA2Y,short,Why You Don't Like Doing Creative Work Anymore,@thefutur,https://www.youtube.com/watch?v=w6wW3-awA2Y,NA,2026-07-14,L0-discovered,3,,views=16000
yt-AEi92BMrDzY,short,How To Inspire Clients To Want To Work With You,@thefutur,https://www.youtube.com/watch?v=AEi92BMrDzY,NA,2026-07-14,L0-discovered,3,,views=13000
yt-eNLL3TyRgeE,short,How To Secure The Job With Big Companies,@thefutur,https://www.youtube.com/watch?v=eNLL3TyRgeE,NA,2026-07-14,L0-discovered,3,,views=11000
yt-FTfVHwegSeM,short,4 Priorities To Win With Every Client,@thefutur,https://www.youtube.com/watch?v=FTfVHwegSeM,NA,2026-07-14,L0-discovered,3,,views=14000
yt-_Bgu2bsLAoE,short,1 Key Factor For Scaling Your Business,@thefutur,https://www.youtube.com/watch?v=_Bgu2bsLAoE,NA,2026-07-14,L0-discovered,3,,views=9300
yt-QXpfcVmHHU4,short,Secret Biz Hack To Beat Your Comp,@thefutur,https://www.youtube.com/watch?v=QXpfcVmHHU4,NA,2026-07-14,L0-discovered,3,,views=10000
yt-U328wWKwhw0,short,Rookie Business Mistakes,@thefutur,https://www.youtube.com/watch?v=U328wWKwhw0,NA,2026-07-14,L0-discovered,3,,views=12000
yt-eY_WVjwt8UM,short,Defining Story Moments,@thefutur,https://www.youtube.com/watch?v=eY_WVjwt8UM,NA,2026-07-14,L0-discovered,3,,views=8600
yt-xuN3gZluAyY,short,The Answer To How Do I Get More Leads?,@thefutur,https://www.youtube.com/watch?v=xuN3gZluAyY,NA,2026-07-14,L0-discovered,3,,views=15000
yt-ap54UqlvYMI,short,Why Clients Aren't Buying From You,@thefutur,https://www.youtube.com/watch?v=ap54UqlvYMI,NA,2026-07-14,L0-discovered,3,,views=40000
yt-uwluFTZXbak,short,Your Weaknesses Are Where The Magic Is,@thefutur,https://www.youtube.com/watch?v=uwluFTZXbak,NA,2026-07-14,L0-discovered,3,,views=14000
yt-dHGYtQSTcPA,short,Have a Core Skill as your foundation,@thefutur,https://www.youtube.com/watch?v=dHGYtQSTcPA,NA,2026-07-14,L0-discovered,3,,views=17000
yt-Hl2QJJwq9RM,short,3 Benefits Of Specializing In Your Niche,@thefutur,https://www.youtube.com/watch?v=Hl2QJJwq9RM,NA,2026-07-14,L0-discovered,3,,views=14000
yt-DUyfG9Hlj1M,short,Simplify Your Positioning,@thefutur,https://www.youtube.com/watch?v=DUyfG9Hlj1M,NA,2026-07-14,L0-discovered,3,,views=19000
yt-GaNkWUKu2Ns,short,#1 Reason Why Most Entrepreneurs Fail,@thefutur,https://www.youtube.com/watch?v=GaNkWUKu2Ns,NA,2026-07-14,L0-discovered,3,,views=19000
yt-dA1zDEzDU5U,short,Spend All Your Down Time Marketing Your Business,@thefutur,https://www.youtube.com/watch?v=dA1zDEzDU5U,NA,2026-07-14,L0-discovered,3,,views=13000
yt-L3zUbQ4PRGA,short,#1 Thing Young Creatives Need To Get Better Clients,@thefutur,https://www.youtube.com/watch?v=L3zUbQ4PRGA,NA,2026-07-14,L0-discovered,3,,views=11000
yt-zVdZm3aS2nM,short,What It Will Actually Take To Build Your Dream Business,@thefutur,https://www.youtube.com/watch?v=zVdZm3aS2nM,NA,2026-07-14,L0-discovered,3,,views=14000
yt-3VMqo9uIZUA,short,How To Convince Buyers That Your Work Is Worth More,@thefutur,https://www.youtube.com/watch?v=3VMqo9uIZUA,NA,2026-07-14,L0-discovered,3,,views=29000
yt-LHXDlo-ZnC4,short,Why You Feel You Aren't Profiting From Your Business,@thefutur,https://www.youtube.com/watch?v=LHXDlo-ZnC4,NA,2026-07-14,L0-discovered,3,,views=12000
yt-At9DwhqLTbg,short,"Yes, No, Maybe…is Misleading",@thefutur,https://www.youtube.com/watch?v=At9DwhqLTbg,NA,2026-07-14,L0-discovered,3,,views=15000
yt-dkPYA6ddQns,short,How To Duplicate Yourself Inside Your Business,@thefutur,https://www.youtube.com/watch?v=dkPYA6ddQns,NA,2026-07-14,L0-discovered,3,,views=14000
yt-_rOcYUnzNuE,short,"It’s Not Too Late, You Just Have To Get Started",@thefutur,https://www.youtube.com/watch?v=_rOcYUnzNuE,NA,2026-07-14,L0-discovered,3,,views=18000
yt-4bguYsCtY88,short,Stop Using Cookie-Cutter Questions—Brand Strategy,@thefutur,https://www.youtube.com/watch?v=4bguYsCtY88,NA,2026-07-14,L0-discovered,3,,views=9500
yt-wR14dYGRNus,short,Your Success Equals Your Decisions,@thefutur,https://www.youtube.com/watch?v=wR14dYGRNus,NA,2026-07-14,L0-discovered,3,,views=11000
yt-_E3JxH7OsZo,short,How To Get Brand Name Clients,@thefutur,https://www.youtube.com/watch?v=_E3JxH7OsZo,NA,2026-07-14,L0-discovered,3,,views=16000
yt-LonD_PbMoWM,short,How Successful People Keep Winning,@thefutur,https://www.youtube.com/watch?v=LonD_PbMoWM,NA,2026-07-14,L0-discovered,3,,views=18000
yt-WllfSTFYDKg,short,Should I Post On My Company Or Personal Page?,@thefutur,https://www.youtube.com/watch?v=WllfSTFYDKg,NA,2026-07-14,L0-discovered,3,,views=16000
yt-ZGwRiwj2_XY,short,Stretch Your Creative Muscles,@thefutur,https://www.youtube.com/watch?v=ZGwRiwj2_XY,NA,2026-07-14,L0-discovered,3,,views=10000
yt-g6s55kP6s8M,short,Don't Compromise Your Life,@thefutur,https://www.youtube.com/watch?v=g6s55kP6s8M,NA,2026-07-14,L0-discovered,3,,views=9200
yt-FPhhPxdXYNY,short,Be The First To Raise An Objection,@thefutur,https://www.youtube.com/watch?v=FPhhPxdXYNY,NA,2026-07-14,L0-discovered,3,,views=14000
yt-d0CDcecTo8s,short,Stop Coming Across As An Amateur In Sales,@thefutur,https://www.youtube.com/watch?v=d0CDcecTo8s,NA,2026-07-14,L0-discovered,3,,views=14000
yt-ghszxunUxj8,short,Your Definition Of Sales Is Wrong,@thefutur,https://www.youtube.com/watch?v=ghszxunUxj8,NA,2026-07-14,L0-discovered,3,,views=14000
yt-07AhJfKt3kw,short,Ask 3 Questions To Find the Real Problem,@thefutur,https://www.youtube.com/watch?v=07AhJfKt3kw,NA,2026-07-14,L0-discovered,3,,views=12000
yt-GUjZaqQDC4E,short,Don't Give Your Time To Every Client That Calls,@thefutur,https://www.youtube.com/watch?v=GUjZaqQDC4E,NA,2026-07-14,L0-discovered,3,,views=17000
yt-3FCDrskZct4,short,Avoid Working With Self Diagnosed Clients,@thefutur,https://www.youtube.com/watch?v=3FCDrskZct4,NA,2026-07-14,L0-discovered,3,,views=12000
yt-BDZ2Qw2FQoA,short,Reframing Problems Into Opportunities,@thefutur,https://www.youtube.com/watch?v=BDZ2Qw2FQoA,NA,2026-07-14,L0-discovered,3,,views=26000
yt-GENfnPWNSXg,short,Why You're Scared To Commit To Your Dreams,@thefutur,https://www.youtube.com/watch?v=GENfnPWNSXg,NA,2026-07-14,L0-discovered,3,,views=19000
yt-nhvb6Lp0pgg,short,Being Busy is Ruining Your Life,@thefutur,https://www.youtube.com/watch?v=nhvb6Lp0pgg,NA,2026-07-14,L0-discovered,3,,views=14000
yt-hs5F-ATWyww,short,Play The Forever Game,@thefutur,https://www.youtube.com/watch?v=hs5F-ATWyww,NA,2026-07-14,L0-discovered,3,,views=17000
yt-vXSp0Ly9JbM,short,This Is Essential For Closing Any Client,@thefutur,https://www.youtube.com/watch?v=vXSp0Ly9JbM,NA,2026-07-14,L0-discovered,3,,views=13000
yt-zoLll0KeMZs,short,How To Actually Be An Expert,@thefutur,https://www.youtube.com/watch?v=zoLll0KeMZs,NA,2026-07-14,L0-discovered,3,,views=9500
yt-C38pck37NP0,short,Your Client's Problem Isn't Always 'THE' Problem,@thefutur,https://www.youtube.com/watch?v=C38pck37NP0,NA,2026-07-14,L0-discovered,3,,views=10000
yt-zyu1mxRnXLQ,short,Building Expertise Is Not An Overnight Thing,@thefutur,https://www.youtube.com/watch?v=zyu1mxRnXLQ,NA,2026-07-14,L0-discovered,3,,views=7500
yt-_uaOluEN228,short,Stop Giving Away Your Thinking For Free,@thefutur,https://www.youtube.com/watch?v=_uaOluEN228,NA,2026-07-14,L0-discovered,3,,views=16000
yt-6CgBo80pSWU,short,How To Get Any Client To Agree To Your Price,@thefutur,https://www.youtube.com/watch?v=6CgBo80pSWU,NA,2026-07-14,L0-discovered,3,,views=15000
yt-dD8El0shyks,short,Naming Your Own Price Is Making You Lose Money,@thefutur,https://www.youtube.com/watch?v=dD8El0shyks,NA,2026-07-14,L0-discovered,3,,views=21000
yt-pSVs5cjaLTo,short,Better Together,@thefutur,https://www.youtube.com/watch?v=pSVs5cjaLTo,NA,2026-07-14,L0-discovered,3,,views=8400
yt-fWfJfQQ62As,short,4 Steps To Find Your Niche,@thefutur,https://www.youtube.com/watch?v=fWfJfQQ62As,NA,2026-07-14,L0-discovered,3,,views=16000
yt-YmDa3vyMYaA,short,"Work Hard, Play Harder",@thefutur,https://www.youtube.com/watch?v=YmDa3vyMYaA,NA,2026-07-14,L0-discovered,3,,views=12000
yt-Fj1zkl679KM,short,How Freelance Creatives Can Make More $$$,@thefutur,https://www.youtube.com/watch?v=Fj1zkl679KM,NA,2026-07-14,L0-discovered,3,,views=15000
yt-Rve35SVxzhY,short,The Only Way To Build Your Own Expertise,@thefutur,https://www.youtube.com/watch?v=Rve35SVxzhY,NA,2026-07-14,L0-discovered,3,,views=11000
yt-AUZ6ZB4Io-E,short,My Message To All The 'Experts' Out There,@thefutur,https://www.youtube.com/watch?v=AUZ6ZB4Io-E,NA,2026-07-14,L0-discovered,3,,views=13000
yt-mQSNZeLHvzg,short,The Key To Success ESPECIALLY If You're Young,@thefutur,https://www.youtube.com/watch?v=mQSNZeLHvzg,NA,2026-07-14,L0-discovered,3,,views=13000
yt-VeYKcj1D4o8,short,Always Use This Technique When Discussing Price,@thefutur,https://www.youtube.com/watch?v=VeYKcj1D4o8,NA,2026-07-14,L0-discovered,3,,views=30000
yt-vXRQNheI8co,short,The Only Time To Discount Your Prices,@thefutur,https://www.youtube.com/watch?v=vXRQNheI8co,NA,2026-07-14,L0-discovered,3,,views=17000
yt-EtyhvGYfUAw,short,Magic Phrase To Avoid Nightmare Clients,@thefutur,https://www.youtube.com/watch?v=EtyhvGYfUAw,NA,2026-07-14,L0-discovered,3,,views=29000
yt-e-KJkU-czTs,short,How To Attract More Leads,@thefutur,https://www.youtube.com/watch?v=e-KJkU-czTs,NA,2026-07-14,L0-discovered,3,,views=12000
yt-wMbYjU_r8hU,short,How To Win Life-Long Clients,@thefutur,https://www.youtube.com/watch?v=wMbYjU_r8hU,NA,2026-07-14,L0-discovered,3,,views=9500
yt-4Co-5TT6tqI,short,How To Write A Mission Statement,@thefutur,https://www.youtube.com/watch?v=4Co-5TT6tqI,NA,2026-07-14,L0-discovered,3,,views=15000
yt-Xsq-9HHGE0w,short,The Ultimate Sales Hack,@thefutur,https://www.youtube.com/watch?v=Xsq-9HHGE0w,NA,2026-07-14,L0-discovered,3,,views=15000
yt-Giu0rTyrvmw,short,How To Be A Good Manager,@thefutur,https://www.youtube.com/watch?v=Giu0rTyrvmw,NA,2026-07-14,L0-discovered,3,,views=11000
yt-vm7A_nSZ4Mw,short,Dealing With Complaining Customers,@thefutur,https://www.youtube.com/watch?v=vm7A_nSZ4Mw,NA,2026-07-14,L0-discovered,3,,views=10000
yt-kZ76SRT5UMk,short,Where The Majority Of Sales Come From,@thefutur,https://www.youtube.com/watch?v=kZ76SRT5UMk,NA,2026-07-14,L0-discovered,3,,views=9800
yt-XjvUXErOpIU,short,How To Not Micro Manage,@thefutur,https://www.youtube.com/watch?v=XjvUXErOpIU,NA,2026-07-14,L0-discovered,3,,views=10000
yt-tQlmD99E28k,short,Experts Don’t Have All The Answers,@thefutur,https://www.youtube.com/watch?v=tQlmD99E28k,NA,2026-07-14,L0-discovered,3,,views=12000
yt-W4B322pJBF0,short,Use A Good Story To Get Clients To Buy,@thefutur,https://www.youtube.com/watch?v=W4B322pJBF0,NA,2026-07-14,L0-discovered,3,,views=14000
yt-Q3Vw0fEKLzk,short,Worst Type Of Client To Do Business With,@thefutur,https://www.youtube.com/watch?v=Q3Vw0fEKLzk,NA,2026-07-14,L0-discovered,3,,views=25000
yt-zPS804lnBtM,short,Book Yourself First To Get Clients?,@thefutur,https://www.youtube.com/watch?v=zPS804lnBtM,NA,2026-07-14,L0-discovered,3,,views=26000
yt-XBIbI0AuPyg,short,Worst Sales Mistake Business Owners Make,@thefutur,https://www.youtube.com/watch?v=XBIbI0AuPyg,NA,2026-07-14,L0-discovered,3,,views=20000
yt-N9Ap7SzE-b0,short,Treat Time As A Currency,@thefutur,https://www.youtube.com/watch?v=N9Ap7SzE-b0,NA,2026-07-14,L0-discovered,3,,views=12000
yt-Si8b7Wixdvk,short,Most Effective Way To Manage Your Time (Framework),@thefutur,https://www.youtube.com/watch?v=Si8b7Wixdvk,NA,2026-07-14,L0-discovered,3,,views=505000
yt-9Kujy9lOp6Y,short,Don't Major In The Minors,@thefutur,https://www.youtube.com/watch?v=9Kujy9lOp6Y,NA,2026-07-14,L0-discovered,3,,views=12000
yt-BOZByhZOYJ4,short,Get High Paying Clients,@thefutur,https://www.youtube.com/watch?v=BOZByhZOYJ4,NA,2026-07-14,L0-discovered,3,,views=30000
yt-5NvUvIuouBY,short,How To Get Started On YouTube,@thefutur,https://www.youtube.com/watch?v=5NvUvIuouBY,NA,2026-07-14,L0-discovered,3,,views=11000
yt-72NdzMQeCYI,short,Put Your Oxygen Mask On First,@thefutur,https://www.youtube.com/watch?v=72NdzMQeCYI,NA,2026-07-14,L0-discovered,3,,views=13000
yt-lHxycBR9xc8,short,How To Price For Value,@thefutur,https://www.youtube.com/watch?v=lHxycBR9xc8,NA,2026-07-14,L0-discovered,3,,views=94000
yt-P67_1gxaflA,short,Wisdom is Experience + Reflection,@thefutur,https://www.youtube.com/watch?v=P67_1gxaflA,NA,2026-07-14,L0-discovered,3,,views=12000
yt-8RfJ6h_pQ-0,short,Low Budget Client (Roleplay),@thefutur,https://www.youtube.com/watch?v=8RfJ6h_pQ-0,NA,2026-07-14,L0-discovered,3,,views=12000
yt-jB_BWNZ0_c8,short,How To Have Infinite Leads,@thefutur,https://www.youtube.com/watch?v=jB_BWNZ0_c8,NA,2026-07-14,L0-discovered,3,,views=17000
yt-otCaH7uT5Us,short,Does The Client Desire a Solution Right Now?,@thefutur,https://www.youtube.com/watch?v=otCaH7uT5Us,NA,2026-07-14,L0-discovered,3,,views=9200
yt-Ynjhj1pz6s8,short,How To Sell Just Your Thinking,@thefutur,https://www.youtube.com/watch?v=Ynjhj1pz6s8,NA,2026-07-14,L0-discovered,3,,views=22000
yt--KfTCoS19iM,short,Should I Niche Down?,@thefutur,https://www.youtube.com/watch?v=-KfTCoS19iM,NA,2026-07-14,L0-discovered,3,,views=13000
yt-Z4ge8n408r8,short,Who Should I Hire First?,@thefutur,https://www.youtube.com/watch?v=Z4ge8n408r8,NA,2026-07-14,L0-discovered,3,,views=15000
yt-dptBWFmo-iE,short,Everyone Is Not As Happy As They Appear on Social,@thefutur,https://www.youtube.com/watch?v=dptBWFmo-iE,NA,2026-07-14,L0-discovered,3,,views=8600
yt-1oBgbRnQAQ4,short,Instagram Hashtag Strategy 2022,@thefutur,https://www.youtube.com/watch?v=1oBgbRnQAQ4,NA,2026-07-14,L0-discovered,3,,views=23000
yt-DNpyP-YIE-U,short,Done Is Better Than Perfect,@thefutur,https://www.youtube.com/watch?v=DNpyP-YIE-U,NA,2026-07-14,L0-discovered,3,,views=22000
yt-kYjhayBDJC0,short,5 Steps To Start Creating Content,@thefutur,https://www.youtube.com/watch?v=kYjhayBDJC0,NA,2026-07-14,L0-discovered,3,,views=14000
yt-i-GHTS18YQ4,short,Your Ability to Say No is Proportionate To Price,@thefutur,https://www.youtube.com/watch?v=i-GHTS18YQ4,NA,2026-07-14,L0-discovered,3,,views=16000
yt-ZXMNAsGZnvY,short,Niche vs. Mass Media,@thefutur,https://www.youtube.com/watch?v=ZXMNAsGZnvY,NA,2026-07-14,L0-discovered,3,,views=17000
yt-PDaDyWJnVk0,short,3 Questions To Unlock Your Superpower,@thefutur,https://www.youtube.com/watch?v=PDaDyWJnVk0,NA,2026-07-14,L0-discovered,3,,views=15000
yt-Di-USE281-Y,short,Stack What Works Into One Post,@thefutur,https://www.youtube.com/watch?v=Di-USE281-Y,NA,2026-07-14,L0-discovered,3,,views=18000
yt-Anx4zuJWEFo,short,Passion is the Genesis of Genius,@thefutur,https://www.youtube.com/watch?v=Anx4zuJWEFo,NA,2026-07-14,L0-discovered,3,,views=9000
yt-Y2-tx2v9Ojw,short,Tips To Grow On Social Media,@thefutur,https://www.youtube.com/watch?v=Y2-tx2v9Ojw,NA,2026-07-14,L0-discovered,3,,views=19000
yt-TslRqJ6e8FY,short,'You're Too Expensive' (Sales Objection),@thefutur,https://www.youtube.com/watch?v=TslRqJ6e8FY,NA,2026-07-14,L0-discovered,3,,views=26000
yt-CyHEDKKcIMk,short,1000 True Fans,@thefutur,https://www.youtube.com/watch?v=CyHEDKKcIMk,NA,2026-07-14,L0-discovered,3,,views=17000
yt-z2GhKNgpcxM,short,How to Get Paid to Think,@thefutur,https://www.youtube.com/watch?v=z2GhKNgpcxM,NA,2026-07-14,L0-discovered,3,,views=16000
yt-7B5JXFFEJ7U,short,Work Life Balance Is A Scam,@thefutur,https://www.youtube.com/watch?v=7B5JXFFEJ7U,NA,2026-07-14,L0-discovered,3,,views=64000
yt-b71evCdR3xA,short,Get Future Work Instead of Money?!!,@thefutur,https://www.youtube.com/watch?v=b71evCdR3xA,NA,2026-07-14,L0-discovered,3,,views=17000
yt-FH0U-D05MrI,short,Content Marketing vs. Direct Sales,@thefutur,https://www.youtube.com/watch?v=FH0U-D05MrI,NA,2026-07-14,L0-discovered,3,,views=14000
yt-Bi5tRuXyteY,short,Are You Really a Brand Strategist?,@thefutur,https://www.youtube.com/watch?v=Bi5tRuXyteY,NA,2026-07-14,L0-discovered,3,,views=17000
yt-SViT4JosuaU,short,What Role Do You Play In Your Business?,@thefutur,https://www.youtube.com/watch?v=SViT4JosuaU,NA,2026-07-14,L0-discovered,3,,views=14000
yt-34Eeq5RWSc0,short,Overcome Your Fear of Public Speaking,@thefutur,https://www.youtube.com/watch?v=34Eeq5RWSc0,NA,2026-07-14,L0-discovered,3,,views=18000
yt-IDlU1gryZxU,short,Should You Quit Your Job?,@thefutur,https://www.youtube.com/watch?v=IDlU1gryZxU,NA,2026-07-14,L0-discovered,3,,views=21000
yt-yTNW1nktSME,short,Reprogram Your Mind,@thefutur,https://www.youtube.com/watch?v=yTNW1nktSME,NA,2026-07-14,L0-discovered,3,,views=13000
yt-1ILv8CspwlI,short,'I Can Get It Cheaper Elsewhere' (Sales Script),@thefutur,https://www.youtube.com/watch?v=1ILv8CspwlI,NA,2026-07-14,L0-discovered,3,,views=35000
yt-RY45y0645tg,short,How To Become Great At Sales,@thefutur,https://www.youtube.com/watch?v=RY45y0645tg,NA,2026-07-14,L0-discovered,3,,views=18000
yt-1uOI0O9VEoc,short,Being 'Unique' Is A Myth,@thefutur,https://www.youtube.com/watch?v=1uOI0O9VEoc,NA,2026-07-14,L0-discovered,3,,views=24000
yt-sI1vLQX0eL8,short,Give Away All Your Secrets,@thefutur,https://www.youtube.com/watch?v=sI1vLQX0eL8,NA,2026-07-14,L0-discovered,3,,views=21000
yt-weiQZmrR304,short,Some Stress Is Good,@thefutur,https://www.youtube.com/watch?v=weiQZmrR304,NA,2026-07-14,L0-discovered,3,,views=22000
yt-l2TS45sUqqI,short,Don’t Rush To Sell When Your Client Isn’t Ready,@thefutur,https://www.youtube.com/watch?v=l2TS45sUqqI,NA,2026-07-14,L0-discovered,3,,views=16000
