id,type,title,channel_or_publisher,url,published,discovered,status,priority,domains,notes
yt-ZeEc8YCpocY,video,8 Core Business Concepts You Need To Know (10min MBA),@thefutur,https://www.youtube.com/watch?v=ZeEc8YCpocY,2020-09-07,2026-07-14,L2,2,business;mindset,"8 Core Business Concepts (10min MBA) — Chris confirmed (plugs his book); the 8: INSIDE = Leadership/Finance/Operations/Growth; OUTSIDE = Product/Service/Sales/Marketing; 'INHERITANCE' model (each embeds those above; internal-before-customer); defs ('product = a predictable unit of value', 'no profit = a front piece of art', ops=minimize-risk, growth=optimize-for-dynamic-market); NEW BOOK: 'CREATE & ORCHESTRATE' (Amazon #1 bestseller, his 2nd book); BIO: first-10-employees PAYROLL-TAX failure; Steve Blank Four-Steps ref; L3-candidate"
yt-GJj7oU8t488,video,How To Create Your Own Luck,@thefutur,https://www.youtube.com/watch?v=GJj7oU8t488,2020-09-02,2026-07-14,L2,2,mindset;business,"How To Create Your Own Luck (Chris dominant; ⚠️ co-panelist 'MARCUS' bio [waited-tables/HealthStream/Nashville/self-taught-coding] = context, MUST NOT leak into Chris persona); NEW: 'luck = byproduct of PREPARATION / it just looks like luck'; CONTROL-vs-AGENCY dichotomy (weather/virus/marketplace out of control → take ownership of the rest); 'business as a SPORT / body as a machine'; 'show up ready every moment'; BIO: hapkido black-belt + intermittent-fasting + martial-arts routine; L3-candidate (Chris parts)"
yt-EeBfMUD7j60,video,Use This Sales Technique The Next Time You Pitch,@thefutur,https://www.youtube.com/watch?v=EeBfMUD7j60,2020-08-19,2026-07-14,L2,1,sales-clients;business,L3-candidate: Eight Mile Principle (name the objection first); BCS examples quarantined; 13 quotes
yt-LMJ2IAvthMI,video,Skills Everyone Needs To Succeed In The 21st Century,@thefutur,https://www.youtube.com/watch?v=LMJ2IAvthMI,2020-08-12,2026-07-14,L2,2,mindset;business,"Skills To Succeed in 21st Century (Chris confirmed; 'Ricky' banter); NEW: Alvin Toffler 'LEARN, UNLEARN, RELEARN' 21st-c-illiteracy anchor; 'information rich, time poor' + education-democratized → discernment-not-access is the constraint; the UNLEARN method = form an 'informed opinion' by comparing conflicting ideas then continuously re-test (learning as recycle loop); 'wind can't break the tree that bends'; L3-candidate"
yt-Y-x5J1SIN2Q,video,How Much Should You Charge To Make Money,@thefutur,https://www.youtube.com/watch?v=Y-x5J1SIN2Q,2020-08-10,2026-07-14,L1,2,,no-captions (no subtitles available)
yt-mdWKRhSH4jQ,video,How To Get Your First Design Client,@thefutur,https://www.youtube.com/watch?v=mdWKRhSH4jQ,2020-08-03,2026-07-14,L2,2,sales-clients;business;mindset,"How To Get Your First Design Client — MIXED (first answer = uncertain Futur team member=context); CHRIS parts: 'PLAN YOUR ESCAPE'/Alcatraz (build relationships + sit-in-on-new-business-meetings WHILE employed), call-your-PROFESSORS-for-referrals (they have clout — Google/Apple/MS call them), start-relationship-BEFORE-you-need-it, heroes-not-mentors (Seth Godin + Bierut 'hijack your mentor'); L3-candidate (Chris parts)"
yt-hYxGucOGIL0,video,Bad Bosses—How To Say No To Unpaid Overtime (Role-play),@thefutur,https://www.youtube.com/watch?v=hYxGucOGIL0,2020-07-30,2026-07-14,L2,2,sales-clients;mindset,"Bad Bosses / Say No To Unpaid Overtime ROLE-PLAY (Chris solo plays employee-'Chris' + boss-'Greg' + debrief; boss lines=villain-caricature NOT belief); extends boundary/say-NO into EMPLOYEE-BOSS overtime; NEW tactics: consistency-principle lever ('are you going back on your word?'), symmetry-of-logic on time, FORCING-ACKNOWLEDGMENT question ('Do you like the work I'm doing?'), disarm-via-smile/whisper, agree-then-find-the-gap; L3-candidate"
yt-VYv1eTDyP3w,video,Teach And Grow Rich,@thefutur,https://www.youtube.com/watch?v=VYv1eTDyP3w,2020-07-29,2026-07-14,L2,2,content-strategy;mindset;business,"Teach And Grow Rich (Chris on BOW panel; Jose 3rd-person + host outro=context); NEW: CONFIDENCE-LOOP formula (try→more-exposed→less-afraid→more-try), 'illusion of mastery' (consumption≠learning), 'highest mastery = teach others to do what you do' + 'one teaches to learn', 'numb to your own story' self-worth reframe, Covey 'to know and not to do is not to know', skill-vs-taste gap (Ira Glass); L3-candidate"
yt-BOpbHKa64w0,video,How To Get Known & Capture Attention in 2020,@thefutur,https://www.youtube.com/watch?v=BOpbHKa64w0,2020-07-27,2026-07-14,L2,2,content-strategy;branding;mindset,"Get Known & Capture Attention 2020 (Chris on BOW panel w/ Jose Caballer+Robbie; editor=context); NEW: CHEFS-share-everything analogy (hoarding technique = 'best kept secret'); advertising-INTERRUPTS/'focus on me' vs permission-marketing 'here's a gift' → know-like-trust; Neumeier 'the brand with the STRONGEST TRIBE wins'; 'ZERO KILOBYTES' community-support (pay to sustain the work, not for the file); authority validated by content/notoriety NOT institutions (AIGA); L3-candidate"
yt-84Mf-CdRin4,video,"Share What You Know, While You Learn To Build An Audience",@thefutur,https://www.youtube.com/watch?v=84Mf-CdRin4,2020-07-23,2026-07-14,L2,2,content-strategy;mindset;business,"Share What You Know While You Learn (Chris on BOW/ArtCenter panel w/ Jose+Robbie; editor-narrator=context); NEW: the '2X RULE' (for every 1 piece consumed, make 2); consume→reflect→implement→share loop → VIRTUOUS-CYCLE-of-confidence; reframe 'teach what you know' → 'share WHILE you learn' (defuses am-I-expert-enough); Rework 'out-teach the competition' + Jim Rohn 'convert learnings to earnings'/documentarian; L3-candidate"
yt-my_p1fDOz00,video,How to Sell Without Being Salesy—Sell Like Crazy,@thefutur,https://www.youtube.com/watch?v=my_p1fDOz00,2020-07-20,2026-07-14,L2,2,sales-clients;mindset,Sell Without Being Salesy (Chris SOLO; 'Sell Like Crazy' in title but Sabri Suby ABSENT/not-mentioned; opening=Google-Ads sponsor-read). Full SALES acronym system (Serve/Ask/Listen/Empathize/Summarize) w/ NEW depth: Serve=fiduciary; what/how/why question-types + 'what's the real challenge for you?'; full-value-listening (Kevin Daley) + transmitting-blind pilot metaphor; labeling-emotion 'it sounds like' (Voss); human-vs-tape-recorder; CONDITIONAL if-then close; 'decide'='to kill'; L3-candidate
yt-By-_gbXjEEM,video,Become a Better Writer in 1 Week? Challenge Accepted,@thefutur,https://www.youtube.com/watch?v=By-_gbXjEEM,2020-07-13,2026-07-14,L2,2,content-strategy,"NOT CHRIS — Better Writer in 1 Week = MATTHEW ENCINA (copy-work challenge: hand-copied 102 Seth-Godin posts, shipped 3 originals; consume→distill→create); do-not-train; Futur one-week-challenge PILOT series; not L3"
yt-u-eqUeANYqA,video,Improve Your Emotional Intelligence (EQ) By Labeling Your Emotions w/ Cynthia Kane,@thefutur,https://www.youtube.com/watch?v=u-eqUeANYqA,2020-07-10,2026-07-14,L2,2,mindset,"EQ by Labeling Emotions — mostly guest CYNTHIA KANE (3rd appearance; superficial→inner-emotion, cappuccino-foam-vs-coffee = HERS); Chris outro only (self-awareness=conversation-with-yourself, 'anything worth doing is difficult'); do-not-train (core=Cynthia); cynthia-kane NOW WARRANTS entity page (3 appearances); not L3"
yt-4I9dsYH0qjk,video,How To Reprogram Your Subconscious Through Journaling: Holistic Psychologist Dr. Nicole Lepera,@thefutur,https://www.youtube.com/watch?v=4I9dsYH0qjk,2020-07-08,2026-07-14,L2,2,mindset,"NOT CHRIS — Reprogram Subconscious via Journaling; Ricky host + guest DR. NICOLE LEPERA ('The Holistic Psychologist'); Chris absent; do-not-train; 'Future Self Journal' (write present-tense as-if-already-true), brain-doesn't-know-real-vs-imagined = HERS; nicole-lepera hold-if-recurs; not L3"
yt-1kztDKkifEA,video,Don't Live Your Parent's Plan—Why The Past Is A Poor Predictor Of The Futur,@thefutur,https://www.youtube.com/watch?v=1kztDKkifEA,2020-07-06,2026-07-14,L2,2,mindset,"Don't Live Your Parent's Plan (Chris confirmed; garbled guest + Greg Gunn outro=context); NEW: parents'-outdated-OS crystallized as ATARI-2600-vs-PS4 analogy; 'the past is a poor predictor' (iPhone→GPS/maps/pagers; AI/deepfakes); love-the-work-outperform-those-who-hate-it; 'living-for-the-weekend = something's wrong' test; Seth Godin The Dip (scarcity=biggest-driver-of-value); BIO: many cousins in traditional professions (law/dentistry/engineering/medicine), many unhappy [immigrant-parents NOT explicitly stated]; L3-candidate"
yt-dyyemDtFSkc,video,The Secret To Making Money w/ Unmesh Dinda PixImperfect,@thefutur,https://www.youtube.com/watch?v=dyyemDtFSkc,2020-07-03,2026-07-14,L2,2,mindset;business,"Secret To Making Money w/ UNMESH DINDA (PiXimperfect, guest ~60%=context; Jim Rohn 70/10/10/10 = Unmesh's); Chris small: recurring Zig Ziglar 'help enough people get what they want' (dated 2020) + BIO color (at 23 blew early money on comics/toys, self-critical); poor transcript; not L3 (weak)"
yt-nd_PiEWF54A,video,How we use Notion at The Futur for Design and Marketing Projects,@thefutur,https://www.youtube.com/watch?v=nd_PiEWF54A,2020-06-29,2026-07-14,L2,2,content-strategy;business,"NOT CHRIS — 'How we use Notion at The Futur' (Notion-sponsored ops tutorial); narrator BEN STROH + Natalia/Alex team; Chris 3rd-person ('Matthew & Chris manage YouTube'); do-not-train; FUTUR ORG context (Kickstarter-style pre-launch validation w/ refunds, Tuesday-launches, 3-5wk pre-launch, async-first remote, channel-ownership map); ben-stroh=new team member; not L3"
yt-o1ObxQOgdHQ,video,How To Learn & Create New Visual Styles,@thefutur,https://www.youtube.com/watch?v=o1ObxQOgdHQ,2020-06-26,2026-07-14,L2,2,design-craft;mindset,"How To Learn & Create New Visual Styles (Chris confirmed, 'assignment I give my students'); NEW: 'FIVE UNCOMFORTABLE VARIABLES, introduce one at a time as a constraint' exercise; the 'MASTER COPY' exercise (rebuild a design you love as closely as possible to absorb a new visual vocabulary); 'those spots are already taken' (develop a uniquely-you POV); L3-candidate"
yt-c0FbJfds2jg,video,How To Raise Your Rates When Someone Says 'I Thought You Were Less Expensive',@thefutur,https://www.youtube.com/watch?v=c0FbJfds2jg,2020-06-25,2026-07-14,L2,2,pricing;sales-clients,How To Raise Rates ('I Thought You Were Cheaper') — Chris coaching (confirmed solo). NEW: FAVOR-PRICE reframe (frame the old rate as a ONE-TIME relationship favor tied to a point-in-time; can't run sustainable biz at that price); 'BIRDS OF A FEATHER' referral-budget-anchoring (referrals cluster at your past band → deliberately break out); qualify-budget-early on referrals (you know the source); close-the-gap-to-Pentagram + make-work-look-expensive (Behance→IG lead-gen); L3-candidate
yt-M0WKce87Nc0,video,Justin Trudeau's 21 Seconds Of Silence Is Powerful—Author Cynthia Kane Explains Why,@thefutur,https://www.youtube.com/watch?v=M0WKce87Nc0,2020-06-24,2026-07-14,L2,2,mindset;sales-clients,"NOT CHRIS — Trudeau 21s-silence w/ CYNTHIA KANE (guest; host=Matthew Encina per outro, uncertain); do-not-train; grounding-vs-weaponized-silence, comfortable-with-the-pause, 'advice monster' (Bungay Stanier); overlaps Chris's silence material but is Cynthia's — keep separate; not L3"
yt-1KXHygr_dZc,video,"Get Three Agreements: Goals, Context & Constraints Before You Start",@thefutur,https://www.youtube.com/watch?v=1KXHygr_dZc,2020-06-23,2026-07-14,L2,2,sales-clients;design-craft,"Three Agreements (goals/context/constraints) — ⚠️ attribution:uncertain, LIKELY MATTHEW ENCINA (names 'Ben', assigns designer-1/2/3, plugs PM-course/pitch-kit); do-not-train pending; goal/context/parameters brief framework + decode coded-language + delegate-with-roles; L3-candidate (GATED)"
yt-f7-VV06V8uY,video,How To Talk About Budget w/ Cynthia Kane,@thefutur,https://www.youtube.com/watch?v=f7-VV06V8uY,2020-06-22,2026-07-14,L2,2,sales-clients;mindset,"NOT CHRIS — Talk About Budget w/ CYNTHIA KANE (guest communication-coach ~all content; her doctrine, kept OUT of Chris's ask-budget-first lane); uncertain host + Encina outro; do-not-train; raise-issues-early-and-small, laundry-pile-up metaphor, proactive over-budget script; cynthia-kane entity candidate; not L3"
yt-1bWeEBjE2wI,video,Should You Show Process Books In Your Portfolio?,@thefutur,https://www.youtube.com/watch?v=1bWeEBjE2wI,2020-06-21,2026-07-14,L1,2,,no-captions (no subtitles available)
yt--XclqJI_ix0,video,How To Talk To Clients That Use Abstract & Unclear Language—Client Roleplay,@thefutur,https://www.youtube.com/watch?v=-XclqJI_ix0,2020-06-19,2026-07-14,L2,2,sales-clients;design-craft,"NOT CHRIS — Talk To Clients w/ Abstract Language, MATTHEW ENCINA (on-screen 'Matthew showcases', interviews 'Ben', plugs his PM-course/pitch-kit); do-not-train; 'BAIT WORDS' decode one-attribute-at-a-time (color/type/whitespace/texture/contrast) + mood-board gut-check; not L3"
yt-RPbrWeBLk1c,video,Your Client Needs You More Than You Need Them,@thefutur,https://www.youtube.com/watch?v=RPbrWeBLk1c,2020-06-18,2026-07-14,L2,2,mindset;sales-clients,"Your Client Needs You More — 2-speaker; substantive 'drop-the-story' emotional-protocol = UNNAMED GUEST; host (maybe Chris, unconfirmed) reflects 'you are the prize'; Encina outro → attribution:uncertain, do-not-train pending; you-are-the-prize abundance-reframe + label-story/name-feeling/choose-target-feeling; not L3"
yt-bcrO04jp9fk,video,How Much To Charge As A Freelancer,@thefutur,https://www.youtube.com/watch?v=bcrO04jp9fk,2020-06-16,2026-07-14,L2,2,pricing;business,"NOT CHRIS — How Much To Charge As A Freelancer, MATTHEW ENCINA (self-ID 'I am your host Matthew Encina'); do-not-train; 3 billing models (hourly/day/project), junior-mid-senior ladder, Joey-Korenman hiring-slide (rate=least-important); Futur context; not L3"
yt-CvUPNobpqZ4,video,Six Tips to Help You Get Hired Out of Design School,@thefutur,https://www.youtube.com/watch?v=CvUPNobpqZ4,2020-06-15,2026-07-14,L2,2,branding;sales-clients;business;mindset,"Six Tips Get Hired Out of Design School — MIXED (Ricky host; Chris does 3 of 6, Charlie + Matthew Encina do others=context). Chris-attributed NEW: market-to-FEWER applied to JOB-HUNTING (research <=10 target companies 'FBI style', $1000-across-1000-vs-10 effort analogy), LinkedIn-RECIPROCITY (block those whose 1st interaction asks-for-job/sells), WORK-ANYWHERE (<15% of clients met face-to-face in 24 yrs), portfolio 'show what you want to be HIRED for not what you do'; BIO: '24 years running a business' (2020); partial L3 (Chris segments only)"
yt-ujxvy5NjeRQ,video,How to Learn Anything! For Creatives & Self Learners—Whiteboard Session Homeschool Edition,@thefutur,https://www.youtube.com/watch?v=ujxvy5NjeRQ,2020-06-09,2026-07-14,L2,1,mindset;content-strategy,L3-candidate: Five Ingredients method + learn-reflect-implement-share cycle; 15 quotes
yt-31Uc5TA8ntA,video,Make A Case Study That Gets Client Work,@thefutur,https://www.youtube.com/watch?v=31Uc5TA8ntA,2020-06-08,2026-07-14,L2,2,content-strategy;design-craft;sales-clients,"Make A Case Study That Gets Client Work (Chris confirmed, 'portfolios at Blind'); NEW: CAPABILITIES DECK (pre-proposal artifact for prospects 'fishing'), case-study 'secret formula' (title→visuals→summary→body; 3-part summary = client-mission→outcome→MEASURABLE-impact), StoryBrand client=hero/you=guide (Donald Miller; Luke/Obi-Wan), CAPTURE-THE-MIDDLE process-visuals (sketches/wireframes/postits 'golden'), 'nothing worse than a case study about kerning'; L3-candidate"
yt-5JC2gx2fh2c,video,How Much To Charge For Professional Commercial Photography,@thefutur,https://www.youtube.com/watch?v=5JC2gx2fh2c,2020-06-01,2026-07-14,L1,2,,no-captions (no subtitles available)
yt-UtDiO5lH-kE,video,Why Working Harder Isn't Getting You Closer To Your Goals,@thefutur,https://www.youtube.com/watch?v=UtDiO5lH-kE,2020-05-28,2026-07-14,L2,2,mindset;business,"Why Working Harder Isn't Getting You Closer (Chris coaches Ricky=context); NEW: 'EVERY YES IS A NO' (opportunity cost), Parkinson's-Law-in-his-words, the 'TWO INTENTIONS' choice (get-job-done vs feel-good/be-right), memento-mori (finite breaths), effort-by-RESULTS-not-hours hard rule (same-outcome→faster-wins); L3-candidate"
yt-NmvSuZeDw60,video,Speak More Confidently: An Introverts Guide to Working with Clients,@thefutur,https://www.youtube.com/watch?v=NmvSuZeDw60,2020-05-26,2026-07-14,L2,2,sales-clients;mindset,"NOT CHRIS — 'Introverts Guide to Working with Clients' = MATTHEW ENCINA (self-ID); do-not-train; ⚠️ CONFLATION RISK: the wallflower/introvert bio here is ENCINA's NOT Chris's (Chris=loud-introvert — keep separate); 3 lessons (slow-down/deliberate-silence, 'I don't know' is fine, be-curious); recs Coaching-Habit/Celeste-Headlee; not L3"
yt-buq8BbkVTdg,video,Original Is Just A Remix of Old Ideas Presented In A New Way,@thefutur,https://www.youtube.com/watch?v=buq8BbkVTdg,2020-05-25,2026-07-14,L2,2,design-craft;mindset;content-strategy,"Original Is Just A Remix (Chris confirmed; student Qs=context); NEW techniques atop anti-originality stance: redefine target 'new to THIS audience', ADJACENT-FIELD cross-pollination ('the secret to originality is to hide your sources'; fashion→architecture etc, 'creative watering hole'), 'big small' scale-flip, macro-lens assignment, 'we're not looking for new, we're looking for FAMILIAR presented differently'; L3-candidate"
yt-O6Zordo0OXE,video,How To Give Feedback To Teams That Empower & Engage Creativity,@thefutur,https://www.youtube.com/watch?v=O6Zordo0OXE,2020-05-22,2026-07-14,L2,2,business;design-craft,"Give Feedback To Teams (Chris solo, confirmed 'my team'/'Ben'); NEW 6-step internal-critique protocol: FEEL → why → what-specifically → HAND FIX BACK to the maker → recommend only if stuck → negotiate; 'don't rob them of their creativity' (director facilitates, doesn't supply ideas); silence-drill (3s→5s→longer, name-the-pause); scaling rationale ('can't be the only creative genius → you don't scale'); L3-candidate"
yt-MBNbFww_bNw,video,How To Create Your Ideal Client w/ Greg Hickman,@thefutur,https://www.youtube.com/watch?v=MBNbFww_bNw,2020-05-18,2026-07-14,L2,2,sales-clients;business;content-strategy,"NOT CHRIS — 'Create Your Ideal Client w/ Greg Hickman' = 100% GREG HICKMAN (guest, productized-services/onboarding consultant); Chris absent from transcript; do-not-train; train-clients-during-signing-gap/automated-onboarding/kill-scope-creep; greg-hickman entity candidate; not L3"
yt-5EQydy8ixo8,video,There Are Only Two Intentions In Life—Making Hard Decisions,@thefutur,https://www.youtube.com/watch?v=5EQydy8ixo8,2020-05-13,2026-07-14,L0-discovered,2,,views=23742
yt-pn8108evPVk,video,How To Automate Logo Designs for Any Client,@thefutur,https://www.youtube.com/watch?v=pn8108evPVk,2020-05-11,2026-07-14,L2,2,business;design-craft;sales-clients,"NOT CHRIS — Automate Logo Designs, unnamed Futur coach (plugs 'my PM course + pitch kit'); do-not-train; productize/'pre-loaded done-for-you' (descriptor-words→prebuilt style-scapes, templatized worksheets; Built to Sell); not L3"
yt-WcIKtetf2p8,video,3 Tips to Have a Long and Successful Creative Career,@thefutur,https://www.youtube.com/watch?v=WcIKtetf2p8,2020-05-06,2026-07-14,L2,2,mindset;content-strategy,"NOT CHRIS — MATTHEW ENCINA solo (self-ID x2; his own life: Coldplay 'Ink' 2014, founded studio 2007 closed 2009 post-crash); do-not-train; '3 tips: start-before-ready / failure=lesson-to-future-self / experiences-compound'; confirms Encina team-hosted solo content; not L3"
yt-fmiX7cN1CnU,video,Managing Your Team – Should You Let Them Fail?,@thefutur,https://www.youtube.com/watch?v=fmiX7cN1CnU,2020-05-04,2026-07-14,L2,2,business;mindset,"Managing Team/Let Them Fail — coaching (Matthew coachee + Greg Gunn plug=context); ⚠️ primary coach voice UNCERTAIN (softer/therapeutic register, likely Chris unverified) — do-not-train pending; NEW: touch-the-stove consequence-teaching, RUBBER-BAND-expansion progressive delegation, OVER-responsibility-vs-responsibility, fail-at-manageable-scale, pattern-interrupt; L3-candidate (gated)"
yt-UDTCC-uyJF0,video,"Building a Brand, A Design Documentary – Season 1 Trailer",@thefutur,https://www.youtube.com/watch?v=UDTCC-uyJF0,2020-05-01,2026-07-14,L2,2,branding;content-strategy,"NOT CHRIS — Building a Brand S1 TRAILER (montage); Hamiltons (Josh/Christine) + Ben Burns + Matthew Encina; Chris absent; do-not-train; entities/blind context (Hamilton Family Brewery, Rancho Cucamonga); not L3"
yt-HbKnXeZAXoU,video,Why I Started To Charge $10k Per Day—The Whole Story,@thefutur,https://www.youtube.com/watch?v=HbKnXeZAXoU,2020-04-30,2026-07-14,L2,2,pricing;business,⚠️ MISLEADING TITLE — David C. Baker interview; the $10k/day (now $18k) is BAKER's rate NOT Chris's (do NOT file as Chris pricing — would contradict $5k/hr claim); Chris=interviewer; BIO nugget (Chris-attributed): his $10k/day-OBSESSION origin (friend Fabian Geyrhalter mentioned a consultant @$10k/day → 'one of the reasons I do what I do now') — L3 only for that bio; NOTE: 'Fabian Geyrhalter' likely = the garbled 'Fabian Geralt' from yK7Rk7Oe588; do-not-train (rate=Baker)
yt-HNoLn3rapK4,video,Getting Paid To Think w/ David C. Baker,@thefutur,https://www.youtube.com/watch?v=HNoLn3rapK4,2020-04-29,2026-07-14,L2,2,pricing;business,"⚠️ CORRUPTED/mismatched auto-captions (word-salad, Death-Stranding/Dragon-Age) — David C. Baker interview but transcript UNUSABLE; placeholder only, needs re-fetch/Whisper; SPOT-CHECK sibling Baker vids for same bad-caption batch; not L3"
yt-J0tma7rn-rY,video,How To Position Your Design Company And Reduce Competition,@thefutur,https://www.youtube.com/watch?v=J0tma7rn-rY,2020-04-28,2026-07-14,L2,2,branding;business,"David C. Baker interview (positioning segment; sibling of vWAeE4jccs8); ~all Baker frameworks=context (green-zone/optimum-competitors, competitor-count-test 10-200, vertical-vs-horizontal, Google-ized 6-7-of-20-local travel-test); Chris=interviewer (thin); do-not-train; not L3"
yt-vWAeE4jccs8,video,Business Advice For Small Creative Firms w/ David C. Baker,@thefutur,https://www.youtube.com/watch?v=vWAeE4jccs8,2020-04-27,2026-07-14,L2,2,business;sales-clients,"Business Advice Small Firms w/ David C. Baker (guest ~90%, frameworks=context: firm-sizing 'smaller than your opportunity', feeding-the-machine, reverse-build-the-pyramid, 'whoever wants it worst is the loser'); Chris=interviewer; do-not-train; BIO: Chris admits Futur fell into over-hiring 'feeding the machine' trap; partial transcript; not L3"
yt-uBTOI1QG9pc,video,Why Offering To Help Will Get You A Call Back,@thefutur,https://www.youtube.com/watch?v=uBTOI1QG9pc,2020-04-27,2026-07-14,L2,2,sales-clients;mindset,NOT CHRIS — Ben Burns host + guest Errol Gerson/CPA (the 'what can I do to help you?' vs 'got any work?' reframe is GERSON's); Chris named 3rd-person only; do-not-train; not L3
yt-tnpiuqoA-pQ,video,How To Master The Elevator Pitch And Make A Great First Impression,@thefutur,https://www.youtube.com/watch?v=tnpiuqoA-pQ,2020-04-24,2026-07-14,L2,2,sales-clients;branding,Elevator Pitch — the 'You know how [problem] / I-We solve that [solution] / Here's the proof [examples]' 3-part template; ⚠️ UNCERTAIN narrator (Ricky refers to Chris 3rd-person) — do-not-train pending verification; Pro-member demos=context; L3-candidate (gated)
yt-kLgixmrLUlg,video,5 Tips To Get More Instagram Followers (7 minute video),@thefutur,https://www.youtube.com/watch?v=kLgixmrLUlg,2020-04-23,2026-07-14,L2,2,content-strategy,NOT CHRIS — IG series pt4 (5-tips-more-followers); unnamed team member (refers to Chris 3rd-person 'Chris did a bad job explaining'; likely Ben Burns unconfirmed); do-not-train; post-2x/day/reply-to-all/comments→carousels/hashtag-mix; not L3
yt-t-7kpMQsRCA,video,Why Your Instagram Carousels Are Being Ignored— Use AIDA technique,@thefutur,https://www.youtube.com/watch?v=t-7kpMQsRCA,2020-04-22,2026-07-14,L2,2,content-strategy;branding,"IG series pt3 (carousels/AIDA) — CHRIS confirmed (first-person 'my pro community'/'my wife'/'when I taught sequential design'; Ricky 7s intro=context); NEW: AIDA-for-carousels (Desire=give-details), get-past-SLIDE-3-or-algorithm-suppresses, 'magic 8' middle (10 max minus hook+CTA), slide-1=type+image magnet, densest-value-in-MIDDLE, breath/comma=new-slide, 'cotton candy' empty-content; L3-candidate"
yt-ZkQM-WBeRjc,video,How To Define Your Audience For Instagram,@thefutur,https://www.youtube.com/watch?v=ZkQM-WBeRjc,2020-04-21,2026-07-14,L2,2,content-strategy,"NOT CHRIS — IG series pt2 (define-audience); RICKY (self-ID 'Ricky here'); do-not-train; build-audience-not-customers, day-in-the-life gaps × your strengths, highest-impact/least-effort; not L3"
yt-ZbFak7vZvVQ,video,Why You Should Use New Features To Exploit The Instagram Algorithm (4 min video),@thefutur,https://www.youtube.com/watch?v=ZbFak7vZvVQ,2020-04-20,2026-07-14,L2,2,content-strategy,"IG series pt1 (new-features/algorithm); Ricky intro + UNCONFIRMED main speaker (never self-IDs) — attribution:uncertain, do-not-train; 'big three' platforms, adopt-new-features-early; not L3"
yt-mXi7SGXZYVQ,video,How to Protect Yourself from Bad Clients,@thefutur,https://www.youtube.com/watch?v=mXi7SGXZYVQ,2020-04-14,2026-07-14,L2,2,sales-clients;business;pricing,"NOT CHRIS — 'Brutally Honest w Emily Cohen' (guest design-biz consultant; frameworks HERS: 'raise fee ~10% per red flag', red-flag inventory, fire-1-client/yr, firing scripts); Chris = host/reactor + 'can you fire me?' roleplay; do-not-train; emily-cohen entity candidate; not L3"
yt-mpOGY4bMoWQ,video,Stop Saying What Everyone Else Is Saying—Tell Me Something I Don't Know,@thefutur,https://www.youtube.com/watch?v=mpOGY4bMoWQ,2020-04-13,2026-07-14,L1,2,,no-captions (no subtitles available)
